{
  "schema_version": "0.1-draft",
  "type_id": "contextual-call",
  "type_version": "0.1.0",
  "descriptor": "contextual-call.component.json",
  "distribution": {
    "name": "slow-thinker-contextual-call",
    "version": "0.1.0"
  },
  "entry_point": "slow_thinker_contextual_call:ContextualCallHost",
  "environment_profile": "trusted-python-host"
}
